{
  "$schema": "./novasteelv3.items-manifest.schema.json",
  "schemaVersion": 1,
  "supportedItems": [
    {
      "key": "eventhouseOperations",
      "type": "Eventhouse",
      "displayName": "evh-novasteelv3-operations",
      "description": "Isolated novasteelv3 hot operational Eventhouse.",
      "restCollection": "/eventhouses",
      "sourceDirectory": "items/evh-ns-operations.Eventhouse",
      "definitionFormat": null,
      "definitionParts": [],
      "createWithoutDefinition": true,
      "cliDeployable": false,
      "bindingGate": null,
      "deploymentOption": "deployEventhouseAndKql",
      "dependencies": [],
      "manualGates": [
        "Confirm the isolated novasteelv3 workspace is assigned to the running F2 capacity before this item is created.",
        "Validate retention/cache cost and cold-start behavior for the demo capacity."
      ]
    },
    {
      "key": "landingLakehouse",
      "type": "Lakehouse",
      "displayName": "lh_novasteelv3_landing",
      "description": "Isolated novasteelv3 immutable bronze envelopes and quarantine landing.",
      "restCollection": "/lakehouses",
      "sourceDirectory": "items/lh-ns-landing.Lakehouse",
      "definitionFormat": null,
      "definitionParts": [],
      "createWithoutDefinition": true,
      "cliDeployable": false,
      "bindingGate": null,
      "deploymentOption": "deployLakehouses",
      "dependencies": [],
      "manualGates": [
        "Apply and verify current OneLake security roles and sensitivity label in the target tenant.",
        "Verify that no shortcut crosses into the existing NovaSteel workspaces or lakehouses."
      ]
    },
    {
      "key": "coreLakehouse",
      "type": "Lakehouse",
      "displayName": "lh_novasteelv3_core",
      "description": "Isolated novasteelv3 typed silver facts, SCD dimensions, and gold KPI tables.",
      "restCollection": "/lakehouses",
      "sourceDirectory": "items/lh-ns-core.Lakehouse",
      "definitionFormat": null,
      "definitionParts": [],
      "createWithoutDefinition": true,
      "cliDeployable": false,
      "bindingGate": null,
      "deploymentOption": "deployLakehouses",
      "dependencies": [],
      "manualGates": [
        "Apply and verify current OneLake security roles and sensitivity label in the target tenant.",
        "Confirm the workspace/notebook identity can read landing and write core only."
      ]
    },
    {
      "key": "kqlOperations",
      "type": "KQLDatabase",
      "displayName": "kql-ns-operations",
      "description": "Isolated novasteelv3 hot telemetry, alarms, gateway health, inference, and quarantine.",
      "restCollection": "/kqlDatabases",
      "sourceDirectory": "items/kql-ns-operations.KQLDatabase",
      "definitionFormat": null,
      "definitionParts": ["DatabaseProperties.json", "DatabaseSchema.kql", ".platform"],
      "createWithoutDefinition": false,
      "cliDeployable": true,
      "bindingGate": null,
      "deploymentOption": "deployEventhouseAndKql",
      "dependencies": ["eventhouseOperations"],
      "manualGates": [
        "Measure retention/cache cost and adjust the novasteelv3 retention values before enabling long-lived demos.",
        "Confirm KQL query/ingestion endpoints and item identity support before any non-demo use."
      ]
    },
    {
      "key": "notebookInitialize",
      "type": "Notebook",
      "displayName": "v3-initialize-lakehouses",
      "description": "Create Delta medallion tables and reference targets idempotently for novasteelv3.",
      "restCollection": "/notebooks",
      "sourceDirectory": "notebooks/ns-initialize-lakehouses.Notebook",
      "definitionFormat": "ipynb",
      "definitionParts": ["notebook-content.py", ".platform"],
      "createWithoutDefinition": false,
      "cliDeployable": true,
      "bindingGate": null,
      "deploymentOption": "deployNotebooks",
      "dependencies": ["landingLakehouse", "coreLakehouse"],
      "manualGates": [
        "Attach or authorize the novasteelv3 landing/core Lakehouses for the notebook execution identity."
      ]
    },
    {
      "key": "notebookLoadReferenceData",
      "type": "Notebook",
      "displayName": "v3-load-reference-data",
      "description": "Idempotently load the simulator-owned reference dimensions (dim_plant, dim_asset, dim_sensor, dim_grade, dim_calendar) from OneLake Files into lh_novasteelv3_core. Bronze-to-silver quarantines every event as UNKNOWN_ASSET until these are populated.",
      "restCollection": "/notebooks",
      "sourceDirectory": "notebooks/ns-load-reference-data.Notebook",
      "definitionFormat": "ipynb",
      "definitionParts": ["notebook-content.py", ".platform"],
      "createWithoutDefinition": false,
      "cliDeployable": true,
      "bindingGate": null,
      "deploymentOption": "deployNotebooks",
      "dependencies": ["coreLakehouse", "notebookInitialize"],
      "manualGates": [
        "Upload the reference CSVs to Files/reference-data/ before running (tools/fabric/Load-AnalyticalGold.ps1 -Layer reference).",
        "Must run before v3-bronze-to-silver: every event is quarantined as UNKNOWN_ASSET (DQ-REF-001) while the dimensions are empty."
      ]
    },
    {
      "key": "notebookOntologyBindings",
      "type": "Notebook",
      "displayName": "v3-ontology-bindings",
      "description": "Materialize the nine purpose-built onto_* Delta serving tables in lh_novasteelv3_core (four static entities, three time series, two relationships) that a Fabric IQ Ontology item binds to, casting silver string timestamps to real TimestampType.",
      "restCollection": "/notebooks",
      "sourceDirectory": "notebooks/ns-ontology-bindings.Notebook",
      "definitionFormat": "ipynb",
      "definitionParts": ["notebook-content.py", ".platform"],
      "createWithoutDefinition": false,
      "cliDeployable": true,
      "bindingGate": null,
      "deploymentOption": "deployNotebooks",
      "dependencies": ["coreLakehouse", "notebookSilverToGold", "notebookDemoScoring"],
      "manualGates": [
        "Run after silver/gold and demo scoring so dim_*, fact_telemetry, fact_furnace_rul and the daily facts are populated.",
        "Table and column names are FROZEN: the Fabric IQ Ontology definition is authored against exactly these onto_* names."
      ]
    },
    {
      "key": "notebookSeedBronzeFromPack",
      "type": "Notebook",
      "displayName": "v3-seed-bronze-from-pack",
      "description": "Expand the committed operational envelope pack into landing.bronze_event_envelope so the medallion has every event family, not just the thin telemetry slice the Eventstream captured. Idempotent MERGE on event_id.",
      "restCollection": "/notebooks",
      "sourceDirectory": "notebooks/ns-seed-bronze-from-pack.Notebook",
      "definitionFormat": "ipynb",
      "definitionParts": ["notebook-content.py", ".platform"],
      "createWithoutDefinition": false,
      "cliDeployable": true,
      "bindingGate": null,
      "deploymentOption": "deployNotebooks",
      "dependencies": ["landingLakehouse", "coreLakehouse", "notebookInitialize"],
      "manualGates": [
        "Upload the NDJSON pack to Files/operational-envelopes/ before running (tools/fabric/Load-AnalyticalGold.ps1 -Layer operational).",
        "Demo/dev/test only: it replays a deterministic pack into the landing zone that the Eventstream also writes to."
      ]
    },
    {
      "key": "notebookLoadOperationalEnvelopes",
      "type": "Notebook",
      "displayName": "v3-load-operational-envelopes",
      "description": "Idempotently load the operational simulator-envelope datasets (uploaded to OneLake Files as NDJSON) into lh_novasteelv3_core Delta tables that the BFF reads when BFF_DATA_SOURCE=fabric.",
      "restCollection": "/notebooks",
      "sourceDirectory": "notebooks/ns-load-operational-envelopes.Notebook",
      "definitionFormat": "ipynb",
      "definitionParts": ["notebook-content.py", ".platform"],
      "createWithoutDefinition": false,
      "cliDeployable": true,
      "bindingGate": null,
      "deploymentOption": "deployNotebooks",
      "dependencies": ["coreLakehouse", "notebookInitialize"],
      "manualGates": [
        "Upload the NDJSON pack to Files/operational-envelopes/ before running (tools/fabric/Load-AnalyticalGold.ps1 -Layer operational).",
        "The nine dataset names must stay in sync with simulator/fabric_operational.OPERATIONAL_DATASETS and bff_api.fabric_source.KNOWN_DATASETS."
      ]
    },
    {
      "key": "notebookLoadAnalyticalGold",
      "type": "Notebook",
      "displayName": "v3-load-analytical-gold",
      "description": "Idempotently load the multi-month analytical gold facts (uploaded to OneLake Files) into lh_novasteelv3_core Delta tables.",
      "restCollection": "/notebooks",
      "sourceDirectory": "notebooks/ns-load-analytical-gold.Notebook",
      "definitionFormat": "ipynb",
      "definitionParts": ["notebook-content.py", ".platform"],
      "createWithoutDefinition": false,
      "cliDeployable": true,
      "bindingGate": null,
      "deploymentOption": "deployNotebooks",
      "dependencies": ["coreLakehouse", "notebookInitialize"],
      "manualGates": [
        "Upload the gold CSV pack to Files/analytical-gold/<scenario>/ before running (tools/fabric/Load-AnalyticalGold.ps1).",
        "Idempotency keys must stay in sync with simulator/analytics.py::IDEMPOTENCY_KEYS and contracts/data/gold.v2.json."
      ]
    },
    {
      "key": "notebookBronzeToSilver",
      "type": "Notebook",
      "displayName": "v3-bronze-to-silver",
      "description": "Validate, deduplicate, normalize, SCD-resolve, and quarantine bronze events for novasteelv3.",
      "restCollection": "/notebooks",
      "sourceDirectory": "notebooks/ns-bronze-to-silver.Notebook",
      "definitionFormat": "ipynb",
      "definitionParts": ["notebook-content.py", ".platform"],
      "createWithoutDefinition": false,
      "cliDeployable": true,
      "bindingGate": null,